{
  "uri": "nexus://bi/template/nexus_usage",
  "id": "nexus_usage",
  "title": [
    {
      "text": "Nexi people & activity",
      "lang": "en"
    },
    {
      "text": "Люди та активність Nexi",
      "lang": "uk"
    }
  ],
  "decision_kinds": [
    "adoption_review",
    "capacity_planning"
  ],
  "platform": true,
  "pack_ref": "nexus://core/pack/nexus-base",
  "version": "1.0.0",
  "slots": [
    {
      "id": "sec_chat",
      "kind": "section",
      "role": "conversations",
      "required": true,
      "recommended_size": {
        "w": 12,
        "h": 1
      }
    },
    {
      "id": "routes",
      "kind": "metric",
      "role": "volume",
      "required": true,
      "recommended_size": {
        "w": 3,
        "h": 2
      },
      "metric_key": "routes_total",
      "metric_hint": "volume"
    },
    {
      "id": "fallback",
      "kind": "metric",
      "role": "risk",
      "required": true,
      "recommended_size": {
        "w": 3,
        "h": 2
      },
      "metric_key": "routes_fallback_ratio",
      "metric_hint": "risk"
    },
    {
      "id": "flows",
      "kind": "metric",
      "role": "volume",
      "required": true,
      "recommended_size": {
        "w": 3,
        "h": 2
      },
      "metric_key": "flow_runs_total"
    },
    {
      "id": "flows_failed",
      "kind": "metric",
      "role": "risk",
      "required": true,
      "recommended_size": {
        "w": 3,
        "h": 2
      },
      "metric_key": "flow_runs_failed_total"
    },
    {
      "id": "routes_trend",
      "kind": "chart",
      "role": "trend_over_days",
      "required": false,
      "recommended_size": {
        "w": 6,
        "h": 4
      },
      "metric_key": "routes_history",
      "metric_hint": "outcome"
    },
    {
      "id": "flows_trend",
      "kind": "chart",
      "role": "trend_over_days",
      "required": false,
      "recommended_size": {
        "w": 6,
        "h": 4
      },
      "metric_key": "flow_runs_history",
      "metric_hint": "outcome"
    },
    {
      "id": "sec_models",
      "kind": "section",
      "role": "models_and_tools",
      "required": true,
      "recommended_size": {
        "w": 12,
        "h": 1
      }
    },
    {
      "id": "models",
      "kind": "metric",
      "role": "volume",
      "required": true,
      "recommended_size": {
        "w": 3,
        "h": 2
      },
      "metric_key": "model_calls_total"
    },
    {
      "id": "tools",
      "kind": "metric",
      "role": "volume",
      "required": true,
      "recommended_size": {
        "w": 3,
        "h": 2
      },
      "metric_key": "tool_calls_total"
    },
    {
      "id": "tools_failed",
      "kind": "metric",
      "role": "risk",
      "required": false,
      "recommended_size": {
        "w": 3,
        "h": 2
      },
      "metric_key": "tool_calls_failed_total"
    },
    {
      "id": "models_trend",
      "kind": "chart",
      "role": "trend_over_days",
      "required": false,
      "recommended_size": {
        "w": 6,
        "h": 4
      },
      "metric_key": "model_calls_history",
      "metric_hint": "outcome"
    },
    {
      "id": "tools_trend",
      "kind": "chart",
      "role": "trend_over_days",
      "required": false,
      "recommended_size": {
        "w": 6,
        "h": 4
      },
      "metric_key": "tool_calls_history",
      "metric_hint": "outcome"
    },
    {
      "id": "sec_decide",
      "kind": "section",
      "role": "decision_surfaces",
      "required": true,
      "recommended_size": {
        "w": 12,
        "h": 1
      }
    },
    {
      "id": "dashboards",
      "kind": "metric",
      "role": "volume",
      "required": true,
      "recommended_size": {
        "w": 3,
        "h": 2
      },
      "metric_key": "bi_dashboards_total"
    },
    {
      "id": "metrics",
      "kind": "metric",
      "role": "outcome",
      "required": true,
      "recommended_size": {
        "w": 3,
        "h": 2
      },
      "metric_key": "bi_metrics_certified"
    },
    {
      "id": "work_done",
      "kind": "metric",
      "role": "outcome",
      "required": false,
      "recommended_size": {
        "w": 3,
        "h": 2
      },
      "metric_key": "work_items_done"
    },
    {
      "id": "claims",
      "kind": "metric",
      "role": "outcome",
      "required": false,
      "recommended_size": {
        "w": 3,
        "h": 2
      },
      "metric_key": "graph_claims_verified"
    },
    {
      "id": "dashboards_trend",
      "kind": "chart",
      "role": "trend_over_days",
      "required": false,
      "recommended_size": {
        "w": 6,
        "h": 4
      },
      "metric_key": "bi_dashboards_history",
      "metric_hint": "outcome"
    },
    {
      "id": "claims_trend",
      "kind": "chart",
      "role": "trend_over_days",
      "required": false,
      "recommended_size": {
        "w": 6,
        "h": 4
      },
      "metric_key": "graph_claims_verified_history",
      "metric_hint": "outcome"
    },
    {
      "id": "howto",
      "kind": "text",
      "role": "how_to_read",
      "required": false,
      "recommended_size": {
        "w": 4,
        "h": 2
      }
    }
  ]
}
