{
  "uri": "nexus://bi/template/executive_overview",
  "id": "executive_overview",
  "title": [
    {
      "text": "Executive overview",
      "lang": "en"
    },
    {
      "text": "Огляд для керівника",
      "lang": "uk"
    }
  ],
  "decision_kinds": [
    "allocate_attention",
    "report_up"
  ],
  "pack_ref": "nexus://core/pack/nexus-base",
  "version": "1.0.0",
  "slots": [
    {
      "id": "outcome_kpi",
      "kind": "metric",
      "role": "outcome",
      "required": true,
      "recommended_size": {
        "w": 3,
        "h": 2
      },
      "metric_hint": "outcome"
    },
    {
      "id": "volume_kpi",
      "kind": "metric",
      "role": "volume",
      "required": true,
      "recommended_size": {
        "w": 3,
        "h": 2
      },
      "metric_hint": "volume"
    },
    {
      "id": "target_kpi",
      "kind": "metric",
      "role": "target",
      "required": false,
      "recommended_size": {
        "w": 3,
        "h": 2
      },
      "metric_hint": "target"
    },
    {
      "id": "risk_kpi",
      "kind": "metric",
      "role": "risk",
      "required": false,
      "recommended_size": {
        "w": 3,
        "h": 2
      },
      "metric_hint": "risk"
    },
    {
      "id": "trend",
      "kind": "chart",
      "role": "trend",
      "required": true,
      "recommended_size": {
        "w": 8,
        "h": 4
      },
      "metric_hint": "outcome"
    },
    {
      "id": "breakdown",
      "kind": "chart",
      "role": "breakdown_by_driver",
      "required": true,
      "recommended_size": {
        "w": 4,
        "h": 4
      },
      "metric_hint": "driver"
    },
    {
      "id": "insight",
      "kind": "insight",
      "role": "what_changed",
      "required": false,
      "recommended_size": {
        "w": 6,
        "h": 2
      },
      "metric_hint": null
    },
    {
      "id": "notes",
      "kind": "text",
      "role": "notes",
      "required": false,
      "recommended_size": {
        "w": 6,
        "h": 2
      },
      "metric_hint": null
    }
  ]
}
