{
  "uri": "nexus://bi/template/risk_exceptions",
  "id": "risk_exceptions",
  "title": [
    {
      "text": "Risk & exceptions",
      "lang": "en"
    },
    {
      "text": "Ризики та винятки",
      "lang": "uk"
    }
  ],
  "decision_kinds": [
    "escalate",
    "intervene_this_period"
  ],
  "pack_ref": "nexus://core/pack/nexus-base",
  "version": "1.0.0",
  "slots": [
    {
      "id": "risk_kpi",
      "kind": "metric",
      "role": "risk",
      "required": true,
      "recommended_size": {
        "w": 3,
        "h": 2
      },
      "metric_hint": "risk"
    },
    {
      "id": "volume_kpi",
      "kind": "metric",
      "role": "volume",
      "required": false,
      "recommended_size": {
        "w": 3,
        "h": 2
      },
      "metric_hint": "volume"
    },
    {
      "id": "exceptions",
      "kind": "table",
      "role": "exceptions_by_driver",
      "required": true,
      "recommended_size": {
        "w": 8,
        "h": 6
      },
      "metric_hint": "driver"
    },
    {
      "id": "risk_trend",
      "kind": "chart",
      "role": "risk_trend",
      "required": false,
      "recommended_size": {
        "w": 4,
        "h": 4
      },
      "metric_hint": "risk"
    },
    {
      "id": "period",
      "kind": "filter",
      "role": "period",
      "required": false,
      "recommended_size": {
        "w": 3,
        "h": 1
      },
      "metric_hint": null
    },
    {
      "id": "insight",
      "kind": "insight",
      "role": "what_changed",
      "required": false,
      "recommended_size": {
        "w": 6,
        "h": 2
      },
      "metric_hint": null
    }
  ]
}
