{
  "uri": "nexus://bi/template/operational_control",
  "id": "operational_control",
  "title": [
    {
      "text": "Operational control",
      "lang": "en"
    },
    {
      "text": "Операційний контроль",
      "lang": "uk"
    }
  ],
  "decision_kinds": [
    "intervene_this_period"
  ],
  "pack_ref": "nexus://core/pack/nexus-base",
  "version": "1.0.0",
  "slots": [
    {
      "id": "outcome_kpi",
      "kind": "metric",
      "role": "outcome",
      "required": true,
      "recommended_size": {
        "w": 3,
        "h": 2
      },
      "metric_hint": "outcome"
    },
    {
      "id": "volume_kpi",
      "kind": "metric",
      "role": "volume",
      "required": false,
      "recommended_size": {
        "w": 3,
        "h": 2
      },
      "metric_hint": "volume"
    },
    {
      "id": "trend",
      "kind": "chart",
      "role": "trend_vs_target",
      "required": true,
      "recommended_size": {
        "w": 8,
        "h": 4
      },
      "metric_hint": "outcome"
    },
    {
      "id": "breakdown",
      "kind": "table",
      "role": "breakdown_by_driver",
      "required": true,
      "recommended_size": {
        "w": 4,
        "h": 6
      },
      "metric_hint": "driver"
    },
    {
      "id": "risk",
      "kind": "metric",
      "role": "risk",
      "required": false,
      "recommended_size": {
        "w": 3,
        "h": 2
      },
      "metric_hint": "risk"
    },
    {
      "id": "insight",
      "kind": "insight",
      "role": "what_changed",
      "required": false,
      "recommended_size": {
        "w": 6,
        "h": 2
      },
      "metric_hint": null
    }
  ]
}
